,question,answer,contexts,ground_truth
0,Apakah pekerja berhak mendapatkan pelatihan?,"Ya, setiap pekerja berhak untuk memperoleh dan/atau meningkatkan dan/atau mengembangkan kompetensi kerja sesuai dengan bakat, minat, dan kemampuannya melalui pelatihan kerja yang diselenggarakan oleh lembaga pelatihan kerja pemerintah, lembaga pelatihan kerja swasta, atau pelatihan di tempat kerja.","['(1) Tenaga kerja berhak memperoleh pengakuan kompetensi kerja setelah mengikuti pelatihan kerja\nyang di selenggarakan lembaga pelatihan kerja pemerintah, lembaga pelatihan kerja swasta,\natau pelatihan di tempat kerja.\n (2) Pengakuan kompetensi kerja sebagaimana dimaksud dalam ayat (1) dilakukan melalui sertifikasi\nkompe tensi kerja.\n (3) Sertifikasi kompetensi kerja sebagaimana dimaksud dalam ayat (2) dapat pula diikuti oleh tenaga\nkerja yang telah berpengalaman.\n (4) Untuk melaksanakan sertifikasi kompetensi kerja dibentuk badan nasional sertifikasi profesi yang\ninde penden.\n (5) Pembentukan badan nasional sertifikasi profesi yang independen sebagaimana dimaksud dalam\nayat (4) diatur dengan Peraturan Pemerintah.\n Pasal 19\nPelatihan kerja bagi tenaga kerja penyandang cacat dilaksanakan dengan memperhatikan jenis,\nderajat kecacatan, dan kemampuan tenaga kerja penyandang cacat yang bersangkutan.\n Pasal 20\n(1) Untuk mendukung peningkatan pelatihan kerja dalam rangka pembangunan ketenagakerjaan,\ndikembang kan satu sistem pelatihan kerja nasional yang merupakan acuan pelaksanaan\npelatihan kerja di semua bidang dan/atau sektor.\n (2) Ketentuan mengenai bentuk, mekanisme, dan kelembagaan sistem pelatihan kerja nasional\nsebagaimana dimaksud dalam ayat (1) diatur dengan Peraturan Pemerintah.\n Pasal 21\nPelatihan kerja dapat diselenggarakan dengan sistem pemagangan.\n', 'BAB V\nPELATIHAN KERJA\nPasal 9\nPelatihan kerja diselenggarakan dan diarahkan untuk membekali, meningkatkan, dan\nmengembangkan kompetensi kerja guna meningkatkan kemampuan, produktivitas, dan\nkesejahteraan.\n Pasal 10\n(1) Pelatihan kerja dilaksanakan dengan memperhatikan kebutuhan pasar kerja dan dunia usaha,\nbaik di da-lam maupun di luar hubungan kerja.\n (2) Pelatihan kerja diselenggarakan berdasarkan program pelatihan yang mengacu pada standar\nkompetensi kerja.\n (3) Pelatihan kerja dapat dilakukan secara berjenjang.\n (4) Ketentuan mengenai tata cara penetapan standar kompetensi kerja sebagaimana dimaksud dalam\nayat (2) diatur dengan Keputusan Menteri.\n Pasal 11\nSetiap tenaga kerja berhak untuk memperoleh dan/atau meningkatkan dan/atau\nmengembangkan kompetensi kerja sesuai dengan bakat, minat, dan kemampuannya melalui\npelatihan kerja.\n Pasal 12\n(1) Pengusaha bertanggung jawab atas peningkatan dan/atau pengembangan kompetensi\npekerjanya melalui pelatihan kerja.\n (2) Peningkatan dan/atau pengembangan kompetensi sebagaimana dimaksud dalam ayat (1)\ndiwajibkan bagi pengusaha yang memenuhi persyaratan yang diatur dengan Keputusan Menteri.\n (3) Setiap pekerja/buruh memiliki kesempatan yang sama untuk mengikuti pelatihan kerja sesuai\ndengan bi-dang tugasnya.\n Pasal 13\n(1) Pelatihan kerja diselenggarakan oleh lembaga pelatihan kerja pemerintah dan/atau lembaga\npelatihan kerja swasta.\n (2) Pelatihan kerja dapat diselenggarakan di tempat pelatihan atau tempat kerja.\n (3) Lembaga pelatihan kerja pemerintah sebagaimana dimaksud dalam ayat (1) dalam\nmenyelenggarakan pe-latihan kerja dapat bekerja sama dengan swasta.\n Pasal 14\n(1) Lembaga pelatihan kerja swasta dapat berbentuk badan hukum Indonesia atau perorangan.', 'BAB V\nPELATIHAN KERJA\nPasal 9\nPelatihan kerja diselenggarakan dan diarahkan untuk membekali, meningkatkan, dan\nmengembangkan kompetensi kerja guna meningkatkan kemampuan, produktivitas, dan\nkesejahteraan.\n Pasal 10\n(1) Pelatihan kerja dilaksanakan dengan memperhatikan kebutuhan pasar kerja dan dunia usaha,\nbaik di da-lam maupun di luar hubungan kerja.\n (2) Pelatihan kerja diselenggarakan berdasarkan program pelatihan yang mengacu pada standar\nkompetensi kerja.\n (3) Pelatihan kerja dapat dilakukan secara berjenjang.\n (4) Ketentuan mengenai tata cara penetapan standar kompetensi kerja sebagaimana dimaksud dalam\nayat (2) diatur dengan Keputusan Menteri.\n Pasal 11\nSetiap tenaga kerja berhak untuk memperoleh dan/atau meningkatkan dan/atau\nmengembangkan kompetensi kerja sesuai dengan bakat, minat, dan kemampuannya melalui\npelatihan kerja.\n Pasal 12\n(1) Pengusaha bertanggung jawab atas peningkatan dan/atau pengembangan kompetensi\npekerjanya melalui pelatihan kerja.\n (2) Peningkatan dan/atau pengembangan kompetensi sebagaimana dimaksud dalam ayat (1)\ndiwajibkan bagi pengusaha yang memenuhi persyaratan yang diatur dengan Keputusan Menteri.\n (3) Setiap pekerja/buruh memiliki kesempatan yang sama untuk mengikuti pelatihan kerja sesuai\ndengan bi-dang tugasnya.\n Pasal 13\n(1) Pelatihan kerja diselenggarakan oleh lembaga pelatihan kerja pemerintah dan/atau lembaga\npelatihan kerja swasta.\n (2) Pelatihan kerja dapat diselenggarakan di tempat pelatihan atau tempat kerja.\n (3) Lembaga pelatihan kerja pemerintah sebagaimana dimaksud dalam ayat (1) dalam\nmenyelenggarakan pe-latihan kerja dapat bekerja sama dengan swasta.\n Pasal 14\n(1) Lembaga pelatihan kerja swasta dapat berbentuk badan hukum Indonesia atau perorangan.']","Setiap tenaga kerja berhak untuk mengembangkan kompetensi kerja sesuai dengan bakat, minat, dan kemampuannya melalui pelatihan kerja. Pengusaha juga memiliki tanggung jawab atas pengembangan kompetensi tenaga kerjanya."
1,"Dalam pekerjaan dengan waktu tertentu, apabila pemberi kerja memutuskan hubungan kerja sebelum habisnya jangka waktu yang ditetapkan, apa kewajiban yang harus dipenuhi?","Jika pemberi kerja memutuskan hubungan kerja sebelum kontrak berakhir dalam perjanjian kerja waktu tertentu, maka pemberi kerja mempunyai kewajiban untuk membayar ganti rugi kepada pekerja, dengan jumlah ganti rugi sebesar upah yang diterima oleh pekerja sejak tanggal pemutusan hubungan sampai dengan tanggal berakhirnya perjanjian kerja.","['C. Perjanjian Kerja untuk Suatu Jangka Waktu Tertentu\nSuatu Perjanjian kerja waktu tertentu hanya dapat dibuat untuk\npekerjaan atas dasar jangka waktu tertentu atau selesainya pekerjaan tersebut(Pasal 56 ).\n Suatu Perjanjian kerja waktu tertentu harus dibuat tertulis dalam bahasa\nIndonesia, kalau tidak, pekerjaan itu akan dianggap menjadi pekerjaan waktutidak tertentu.   Dalam hal perjanjian  kerja dibuat dalam bahasa Indonesiadan bahasa asing, dan apabila kemudian terdapat perbedaan penafsiran antarakeduanya, maka yang berlaku adalah perjanjian yang dibuat dalam bahasaIndonesia ( Pasal  57 ).\n Pekerjaan yang berdasarkan sifatnya tetap tidak dapat dibuat perjanjian\nkerja waktu tertentu.  Suatu perjanjian kerja waktu tertentu hanya dapatdipergunakan untuk tidak lebih dari 2 tahun dan dapat diperpanjang untukmaksimum satu tahun.  Pembaruan perjanjian kerja ini dapat juga dilakukandengan ketentuan setelah tenggang waktu 30 hari dari tanggal berakhirnyaperjanjian kerja sebelumnya.  Pembaruan perjanjian kerja hanya berlakuuntuk 1 (satu) kali saja dan dapat berlaku untuk  periode tidak lebih dari 2tahun.\n Jika ada persyaratan-persyaratan untuk suatu perjanjian jangka waktu\ntertentu tidak dapat dipenuhi, perjanjian kerja akan dianggap sebagai suatuperjanjian waktu tidak tertentu ( Pasal 59 ).\n Jika ada satu pihak yang memutuskan suatu perjanjian sebelum kontrak\nberakhir, maka pihak yang memutuskan kontrak mempunyai kewajibanuntuk membayar ganti rugi kepada pihak yang lain, jumlah ganti rugi adalahsebesar upah yang diterima oleh pekerja sejak tanggal pemutusan hubungansampai dengan tanggal berakhirnya perjanjian kerja ( Pasal 62 ).\n 16', 'D. Perjanjian Kerja Waktu Tidak Tertentu\nMasa percobaan yang tidak lebih dari 3 (tiga) bulan dapat diberlakukan\ndalam perjanjian kerja waktu tidak tertentu, dan masa berlakunya masapercobaan tersebut tidak dapat diperpanjang.  Sewaktu masa percobaan itupengusaha dilarang untuk melakukan pembayaran upah kurang dari upahminimum yang berlaku ( Pasal 60 ).\n Suatu Perjanjian kerja tidak tertentu dapat dilakukan secara lisan atau\nsecara tertulis dan tidak terbatas pada jenis pekerjaan/tugas tertentu, tidakseperti perjanjian kerja waktu tertentu.   Surat pengangkatan harus dibuatoleh pengusaha jika perjanjian dibuat secara lisan.   Surat pengangkatan palingtidak harus memuat:\nlNama dan alamat pekerja/buruh;\nlTanggal dimana pekerja/buruh mulai bekerja;\nlJenis pekerjaan;\nlUpah.\n (Pasal 63 )\nE. Akhir Perjanjian Kerja\nPerjanjian kerja akan berakhir dengan kejadian-kejadian sebagai berikut\n(Pasal 61 ):\nlPekerja/buruh meninggal dunia;\nlBerakhirnya jangka waktu perjanjian kerja;\nlAdanya putusan atau penetapan lembaga penyelesaian perselisihan\nhubungan industrial (PPHI) yang telah mempunyai kekuatanhukum tetap;\nlAdanya keadaan atau kejadian tertentu yang dicantumkan dalamperjanjian kerja, peraturan perusahaan, atau perjanjian kerja bersamayang dapat menyebabkan berakhirnya hubungan kerja;\nPerjanjian kerja tidak berakhir karena meninggalnya pengusaha, atau\nberalihnya perusahaan, atau akibat perubahan lain atas status perusahaan(Pasal 61(3) ).\n 17', 'B. Peraturan Lain yang Mengatur Perjanjian Kerja\nBiaya-biaya dan kegiatan lain yang diperlukan untuk menyelesaikan\nperjanjian kerja ini harus menjadi tanggung-jawab pengusaha ( Pasal 53 ).\n Setidaknya 2 rangkap perjanjian kerja harus dibuat, masing-masingmempunyai kekuatan hukum yang sama, dan setiap pihak harus memilikisatu ( Pasal 54(3) ).   Perjanjian kerja tidak dapat ditarik atau diubah kecuali\natas persetujuan dari kedua belah pihak ( Pasal 55 ).  Perjanjian kerja itu dapat\ndibuat untuk waktu tertentu atau tidak tertentu ( Pasal 56 ).  Masa percobaan\nhanya dapat dimasukkan untuk suatu perjanjian kerja untuk tidak tertentu(Pasal 58(1) ).\n C. Perjanjian Kerja untuk Suatu Jangka Waktu Tertentu\nSuatu Perjanjian kerja waktu tertentu hanya dapat dibuat untuk\npekerjaan atas dasar jangka waktu tertentu atau selesainya pekerjaan tersebut(Pasal 56 ).\n Suatu Perjanjian kerja waktu tertentu harus dibuat tertulis dalam bahasa\nIndonesia, kalau tidak, pekerjaan itu akan dianggap menjadi pekerjaan waktutidak tertentu.   Dalam hal perjanjian  kerja dibuat dalam bahasa Indonesiadan bahasa asing, dan apabila kemudian terdapat perbedaan penafsiran antarakeduanya, maka yang berlaku adalah perjanjian yang dibuat dalam bahasaIndonesia ( Pasal  57 ).\n Pekerjaan yang berdasarkan sifatnya tetap tidak dapat dibuat perjanjian\nkerja waktu tertentu.  Suatu perjanjian kerja waktu tertentu hanya dapatdipergunakan untuk tidak lebih dari 2 tahun dan dapat diperpanjang untukmaksimum satu tahun.  Pembaruan perjanjian kerja ini dapat juga dilakukandengan ketentuan setelah tenggang waktu 30 hari dari tanggal berakhirnyaperjanjian kerja sebelumnya.  Pembaruan perjanjian kerja hanya berlakuuntuk 1 (satu) kali saja dan dapat berlaku untuk  periode tidak lebih dari 2tahun.\n Jika ada persyaratan-persyaratan untuk suatu perjanjian jangka waktu\ntertentu tidak dapat dipenuhi, perjanjian kerja akan dianggap sebagai suatuperjanjian waktu tidak tertentu ( Pasal 59 ).\n Jika ada satu pihak yang memutuskan suatu perjanjian sebelum kontrak\nberakhir, maka pihak yang memutuskan kontrak mempunyai kewajibanuntuk membayar ganti rugi kepada pihak yang lain, jumlah ganti rugi adalahsebesar upah yang diterima oleh pekerja sejak tanggal pemutusan hubungansampai dengan tanggal berakhirnya perjanjian kerja ( Pasal 62 ).\n']","Apabila pemutusan hubungan kerja dilakukan selain karena pekerja meninggal dunia, maka pemberi kerja wajib membayar ganti rugi sebesar upah pekerja/buruh sampai batas waktu berakhirnya jangka waktu perjanjian kerja."
2,"Saya membutuhkan pekerja muda berusia 14 tahun untuk mengurus anak saya, kemungkinan akan dipekerjakan selama 12 jam per hari, dengan upah di atas upah minimum. Apakah yang saya lakukan melanggar peraturan?","Tidak, mempekerjakan anak berusia 14 tahun selama 12 jam per hari melanggar peraturan ketenagakerjaan. Berdasarkan konteks yang diberikan, jam kerja maksimum untuk anak adalah 7 jam per hari atau 40 jam per minggu untuk 6 hari kerja. Meskipun upah di atas upah minimum, tetap saja melanggar ketentuan perlindungan anak dalam ketenagakerjaan karena melebihi batas jam kerja yang diizinkan.","['e. memberlakukan keselamatan dan kesehatan kerja;\nf. adanya hubungan kerja yang jelas;\ng. memberikan upah sesuai dengan ketentuan yang berlaku ( Pasal\n68,69 ).\n Dalam hal seorang anak bekerja pada tempat yang sama dengan orang\ndewasa, maka tempat kerja untuk anak harus dipisah ( Pasal 72 ).\n Siapapun dilarang mempekerjakan anak pada pekerjaan-pekerjaan yang\nterburuk, seperti:\na. segala pekerjaan dalam bentuk perbudakan atau sejenisnya;b. segala pekerjaan yang melibatkan pornografi;c. semua pekerjaan yang berkaitan dengan narkoba, dan lain-lain yang\nsejenisnya;\nd. semua pekerjaan yang membahayakan kesehatan, keselamatan, dan/\natau moral anak ( Pasal 74 ).\n B. Pekerja Perempuan\nPasal 76 mengatur bahwa perempuan berusia dibawah 18 tahun tidak\ndiijinkan untuk bekerja antara jam 23.00 – 07.00.   Larangan juga berlakubagi perempuan hamil karena potensi risiko kesehatan.  Perusahaan yangmempekerjakan pekerja perempuan pada jam antara 23.00 – 07.00 harus:\nlmemberikan makanan dan minuman bergizi;\nlmenjaga kesusilaan dan keamanan di tempat kerja;\nlmenyediakan angkutan antar jemput.\n C. Jam Kerja\nJam kerja dapat diatur sebagai berikut:\nl7 (tujuh) jam satu hari dan  40 (empat puluh) jam  per mingguuntuk 6 (enam) hari kerja dalam satu minggu, atau\nl8 (delapan) jam per hari dan 40 (empat puluh) jam per mingguuntuk 5 lima) hari dalam satu minggu.\n Pekerjaan lembur hanya dapat dilaksanakan dengan syarat bahwa\npekerja/buruh bersangkutan telah menyetujuinya, dan pekerjaan lemburadalah maksimum 3 (tiga) jam dalam satu hari dan 14 (empat belas) jamdalam satu minggu.\n 20', 'e. memberlakukan keselamatan dan kesehatan kerja;\nf. adanya hubungan kerja yang jelas;\ng. memberikan upah sesuai dengan ketentuan yang berlaku ( Pasal\n68,69 ).\n Dalam hal seorang anak bekerja pada tempat yang sama dengan orang\ndewasa, maka tempat kerja untuk anak harus dipisah ( Pasal 72 ).\n Siapapun dilarang mempekerjakan anak pada pekerjaan-pekerjaan yang\nterburuk, seperti:\na. segala pekerjaan dalam bentuk perbudakan atau sejenisnya;b. segala pekerjaan yang melibatkan pornografi;c. semua pekerjaan yang berkaitan dengan narkoba, dan lain-lain yang\nsejenisnya;\nd. semua pekerjaan yang membahayakan kesehatan, keselamatan, dan/\natau moral anak ( Pasal 74 ).\n B. Pekerja Perempuan\nPasal 76 mengatur bahwa perempuan berusia dibawah 18 tahun tidak\ndiijinkan untuk bekerja antara jam 23.00 – 07.00.   Larangan juga berlakubagi perempuan hamil karena potensi risiko kesehatan.  Perusahaan yangmempekerjakan pekerja perempuan pada jam antara 23.00 – 07.00 harus:\nlmemberikan makanan dan minuman bergizi;\nlmenjaga kesusilaan dan keamanan di tempat kerja;\nlmenyediakan angkutan antar jemput.\n C. Jam Kerja\nJam kerja dapat diatur sebagai berikut:\nl7 (tujuh) jam satu hari dan  40 (empat puluh) jam  per mingguuntuk 6 (enam) hari kerja dalam satu minggu, atau\nl8 (delapan) jam per hari dan 40 (empat puluh) jam per mingguuntuk 5 lima) hari dalam satu minggu.\n Pekerjaan lembur hanya dapat dilaksanakan dengan syarat bahwa\npekerja/buruh bersangkutan telah menyetujuinya, dan pekerjaan lemburadalah maksimum 3 (tiga) jam dalam satu hari dan 14 (empat belas) jamdalam satu minggu.\n 20', 'e. memberlakukan keselamatan dan kesehatan kerja;\nf. adanya hubungan kerja yang jelas;\ng. memberikan upah sesuai dengan ketentuan yang berlaku ( Pasal\n68,69 ).\n Dalam hal seorang anak bekerja pada tempat yang sama dengan orang\ndewasa, maka tempat kerja untuk anak harus dipisah ( Pasal 72 ).\n Siapapun dilarang mempekerjakan anak pada pekerjaan-pekerjaan yang\nterburuk, seperti:\na. segala pekerjaan dalam bentuk perbudakan atau sejenisnya;b. segala pekerjaan yang melibatkan pornografi;c. semua pekerjaan yang berkaitan dengan narkoba, dan lain-lain yang\nsejenisnya;\nd. semua pekerjaan yang membahayakan kesehatan, keselamatan, dan/\natau moral anak ( Pasal 74 ).\n B. Pekerja Perempuan\nPasal 76 mengatur bahwa perempuan berusia dibawah 18 tahun tidak\ndiijinkan untuk bekerja antara jam 23.00 – 07.00.   Larangan juga berlakubagi perempuan hamil karena potensi risiko kesehatan.  Perusahaan yangmempekerjakan pekerja perempuan pada jam antara 23.00 – 07.00 harus:\nlmemberikan makanan dan minuman bergizi;\nlmenjaga kesusilaan dan keamanan di tempat kerja;\nlmenyediakan angkutan antar jemput.\n C. Jam Kerja\nJam kerja dapat diatur sebagai berikut:\nl7 (tujuh) jam satu hari dan  40 (empat puluh) jam  per mingguuntuk 6 (enam) hari kerja dalam satu minggu, atau\nl8 (delapan) jam per hari dan 40 (empat puluh) jam per mingguuntuk 5 lima) hari dalam satu minggu.\n Pekerjaan lembur hanya dapat dilaksanakan dengan syarat bahwa\npekerja/buruh bersangkutan telah menyetujuinya, dan pekerjaan lemburadalah maksimum 3 (tiga) jam dalam satu hari dan 14 (empat belas) jamdalam satu minggu.\n 20']","Meski anda memberi upah di atas upah minimum, mempekerjakan anak-anak merupakan hal yang dilarang. Ada pengecualian apabila pekerja muda tersebut berusia di antara 13 sampai dengan 15 tahun, untuk dipekerjakan secara ringan tanpa mengganggu perkembangan dan kesehatan fisik, mental, dan sosial. Mempekerjakan 12 jam per hari merupakan pelanggaran, karena hanya diperbolehkan untuk bekerja maksimum 3 jam."
3,"Sanksi atau denda apa yang dapat dikenakan pada pengusaha apabila memberikan perintah kepada saya untuk bekerja di jam 12 malam hingga 5 pagi, sedangkan saya sedang hamil?","Berdasarkan Pasal 187 ayat (1), pengusaha yang mempekerjakan pekerja perempuan yang sedang hamil pada waktu malam hari antara pukul 23.00 hingga 07.00 dapat dikenakan sanksi pidana kurungan paling singkat 1 (satu) bulan dan paling lama 12 (dua belas) bulan dan/atau denda paling sedikit Rp 10.000.000,00 (sepuluh juta rupiah) dan paling banyak Rp 100.000.000,00 (seratus juta rupiah).","['memberikan kesempatan kepada para pekerja untuk menunaikan ibadah yang\ndiwajibkan agamanya,  Pasal 82 tentang hak istirahat melahirkan, Pasal 90(1)\ntentang upah minimum,  Pasal 143 tentang pencegahan hak mogok kerja,\ndan Pasal 160(4) dan (7) tentang mempekerjakan pekerja kembali yang\ndinyatakan tidak bersalah oleh pengadilan , dan tidak membayar uang\npenghargaan masa kerja, dan imbalan atas hak-hak kepada pekerja yangmengalami pemutusah hubungan kerja  dapat dikenakan pidana penjara paling\nsingkat 1 (satu) tahun dan paling lama 5 (lima) tahun dan/atau denda palingsedikit Rp.  100,000,000 (seratus juta rupiah) dan paling banyakRp.400,000,000  (empat ratus juta rupiah) ( Pasal 185 ).\n Barang siapa melanggar ketentuan sebagaimana dimaksud dalam Pasal\n93(2) tentang pengecualian upah bagi para pekerja yang tidak dapat\nmelakukan pekerjaan,  Pasal 137 dan Pasal 138(1) tentang   mogok kerja\ndapat dikenakan saksi pidana penjara paling singkat 1 (satu) bulan danpaling lama 4 (empat) bulan dan/atau denda paling sedikit Rp.  10,000,000(sepuluh juta rupiah) dan paling banyak Rp.400,000,000 (empat ratus jutarupiah) ( Pasal 186 ).\n Barang siapa melanggar ketentuan sebagaimana dimaksud dalam Pasal\n67(1) tentang perlindungan kepada tenaga kerja penyandang cacat,  Pasal 71(2)\ntentang persyaratan untuk mempekerjakan anak, Pasal 76 tentang pekerja\nperempuan,  Pasal 78(2) tentang pembayaran upah kerja lembur, Pasal 79(1)\n(2) tentang waktu istirahat dan istirahat,  Pasal 85(3) tentang pembayaran\nupah kerja lembur pada waktu hari libur resmi,  dan Pasal 144 tentang\nlarangan bagi perusahaan untuk mengganti pekerja dan memberikan sanksikepada para pekerja yang ikut melakukan  mogok kerja  dapat dikenakan\nsanksi pidana kurungan paling singkat 1 (satu) bulan dan paling lama 12(dua belas) bulan dan/atau denda paling sedikit Rp.10,000,000 (sepuluhjuta rupiah) dan paling banyak  Rp.100,000,000 (seratus juta rupiah) ( Pasal\n187).\n Barang siapa melanggar ketentuan sebagaimana dimaksud dalam Pasal\n63(1) tentang  kewajiban untuk membuat surat pengangkatan dalam\nperjanjian kerja waktu tidak tertentu yang dibuat secara lisan,  Pasal 78(1)\ntentang persyaratan waktu kerja lembur, Pasal 108(1) tentang kewajiban\nmembuat peraturan perusahaan, Pasal 111(3) tentang pembaharuan peraturan\nperusahaan,  dan Pasal 148 tentang pemberitahuan tertulis mengenai\npenutupan perusahaan, dikenakan sanksi pidana denda paling sedikit\nRp.5,000,000 – (lima juta rupiah) dan paling banyak Rp.50,000,000 –(lima puluh juta rupiah) ( Pasal 188 ).\n 45', '(4) dan ayat (7), dikenakan sanksi pidana penjara paling singkat 1 (satu) tahun dan paling lama 4\n(empat) tahun dan/atau denda paling sedikit Rp 100.000.000,00 (seratus juta rupiah) dan paling\nbanyak Rp 400.000.000,00 (empat ratus juta rupiah).\n (2) Tindak pidana sebagaimana dimaksud dalam ayat (1) merupakan tindak pidana kejahatan.\n Pasal 186\n(1) Barang siapa melanggar ketentuan sebagaimana dimaksud dalam Pasal 35 ayat (2) dan ayat (3),\nPasal 93 ayat (2), Pasal 137, dan Pasal 138 ayat (1), dikenakan sanksi pidana penjara paling\nsingkat 1 (satu) bulan dan paling lama 4 (empat) tahun dan/atau denda paling sedikit Rp\n10.000.000,00 (sepuluh juta rupiah) dan paling banyak Rp 400.000.000,00 (empat ratus juta\nrupiah).\n (2) Tindak pidana sebagaimana dimaksud dalam ayat (1) merupakan tindak pidana pelanggaran.\n Pasal 187\n(1) Barang siapa melanggar ketentuan sebagaimana dimaksud dalam Pasal 37 ayat (2), Pasal 44\nayat (1), Pasal 45 ayat (1), Pasal 67 ayat (1), Pasal 71 ayat (2), Pasal 76, Pasal 78 ayat (2),\nPasal 79 ayat (1), dan ayat (2), Pasal 85 ayat (3), dan Pasal 144, dikenakan sanksi pidana\nkurungan paling singkat 1 (satu) bulan dan paling lama 12 (dua belas) bulan dan/atau denda\npaling sedikit Rp 10.000.000,00 (sepuluh juta rupiah) dan paling banyak Rp 100.000.000,00\n(seratus juta rupiah).\n (2) Tindak pidana sebagaimana dimaksud dalam ayat (1) merupakan tindak pidana pelanggaran.\n Pasal 188\n(1) Barang siapa melanggar ketentuan sebagaimana dimaksud dalam Pasal 14 ayat (2), Pasal 38\nayat (2), Pasal 63 ayat (1), Pasal 78 ayat (1), Pasal 108 ayat (1), Pasal 111 ayat (3), Pasal 114,\ndan Pasal 148, dikenakan sanksi pidana denda paling sedikit Rp 5.000.000,00 (lima juta rupiah)\ndan paling banyak Rp 50.000.000,00 (lima puluh juta rupiah).\n (2) Tindak pidana sebagaimana dimaksud dalam ayat (1) merupakan tindak pidana pelanggaran.\n Pasal 189\nSanksi pidana penjara, kurungan, dan/atau denda tidak menghilangkan kewajiban pengusaha\nmembayar hak-hak dan/atau ganti kerugian kepada tenaga kerja atau pekerja/buruh.\n Bagian Kedua\nSanksi Administratif\nPasal 190\n(1) Menteri atau pejabat yang ditunjuk mengenakan sanksi administratif atas pelanggaran ketentuan-\nketentuan sebagaimana diatur dalam Pasal 5, Pasal 6, Pasal 15, Pasal 25, Pasal 38 ayat (2),\nPasal 45 ayat (1), Pasal 47 ayat (1), Pasal 48, Pasal 87, Pasal 106, Pasal 126 ayat (3), dan\nPasal 160 ayat (1) dan ayat (2) Undang-undang ini serta peraturan pelaksanaannya.\n (2) Sanksi administratif sebagaimana dimaksud dalam ayat (1) berupa :\na. teguran;\nb. peringatan tertulis;\nc. pembatasan kegiatan usaha;', '(1) Selain penyidik pejabat Polisi Negara Republik Indonesia, juga kepada pegawai pengawas\nketenagakerjaan dapat diberi wewenang khusus sebagai penyidik pegawai negeri sipil sesuai\ndengan peraturan perundang-undangan yang berlaku.\n (2) Penyidik Pegawai Negeri Sipil sebagaimana dimaksud dalam ayat (1) berwenang :\na. melakukan pemeriksaan atas kebenaran laporan serta keterangan tentang tindak pidana\ndi bidang ketenaga-kerjaan;\nb. melakukan pemeriksaan terhadap orang yang diduga melakukan tindak pidana di bidang\nketenagakerjaan;\nc. meminta keterangan dan bahan bukti dari orang atau badan hukum sehubungan dengan\ntindak pidana di bidang ketenagakerjaan;\nd. melakukan pemeriksaan atau penyitaan bahan atau barang bukti dalam perkara tindak\npidana di bidang ketenagakerjaan;\ne. melakukan pemeriksaan atas surat dan/atau dokumen lain tentang tindak pidana di\nbidang ketenagakerjaan;\nf. meminta bantuan tenaga ahli dalam rangka pelaksanaan tugas penyidikan tindak pidana\ndi bidang ketenagakerjaan; dan\ng. menghentikan penyidikan apabila tidak terdapat cukup bukti yang membuktikan tentang\nadanya tindak pidana di bidang ketenagakerjaan.\n (3) Kewenangan penyidik pegawai negeri sipil sebagaimana dimaksud dalam ayat (2) dilaksanakan\nsesuai dengan peraturan perundang-undangan yang berlaku.\n BAB XVI\nKETENTUAN PIDANA DAN\nSANKSI ADMINISTRATIF\nBagian Pertama\nKetentuan Pidana\nPasal 183\n(1) Barang siapa melanggar ketentuan sebagaimana dimaksud dalam Pasal 74, dikenakan sanksi\npidana penjara paling singkat 2 (dua) tahun dan paling lama 5 (lima) tahun dan/atau denda paling\nsedikit Rp 200.000.000,00 (dua ratus juta rupiah) dan paling banyak Rp 500.000.000,00 (lima\nratus juta rupiah).\n (2) Tindak pidana sebagaimana dimaksud dalam ayat (1) merupakan tindak pidana kejahatan.\n Pasal 184\n(1) Barang siapa melanggar ketentuan sebagaimana dimaksud dalam Pasal 167 ayat (5), dikenakan\nsanksi pidana penjara paling singkat 1 (satu) tahun dan paling lama 5 (lima) tahun dan/atau\ndenda paling sedikit Rp 100.000.000,00 (seratus juta rupiah) dan paling banyak Rp\n500.000.000,00 (lima ratus juta rupiah).\n (2) Tindak pidana sebagaimana dimaksud dalam ayat (1) merupakan tindak pidana kejahatan.\n Pasal 185\n(1) Barang siapa melanggar ketentuan sebagaimana dimaksud dalam Pasal 42 ayat (1) dan ayat (2),\nPasal 68, Pasal 69 ayat (2), Pasal 80, Pasal 82, Pasal 90 ayat (1), Pasal 143, dan Pasal 160 ayat']","Pengusaha dilarang untuk memperkjakan perempuan yang sedang hamil antara pukul 23:00 sampai dengan pukul 07:00. Apabila dilanggar, sesuai dengan Pasal 187 ayat 1 pada Undang-undang Nomor 13 Tahun 2003 maka pengusaha dapat dikenakan sanksi pidana kurungan paling singkat 1 (satu) bulan dan paling lama 12 (dua belas) bulan dan/atau denda paling sedikit Rp 10.000.000,00 (sepuluh juta rupiah) dan paling banyak Rp 100.000.000,00 (seratus juta rupiah)."
4,"Dalam 1 minggu ini, saya telah melakukan kerja lembur setiap hari, jika ditotal saya telah lembur sebanyak 21 jam pada minggu ini. Pengusaha membayar saya dengan pizza, apakah itu diperbolehkan?","Tidak, pembayaran upah dengan pizza saja tidak diperbolehkan. Pengusaha wajib membayar upah dalam bentuk uang sesuai dengan ketentuan yang berlaku, bukan barang seperti pizza. Selain itu, total jam lembur 21 jam dalam seminggu telah melebihi batas maksimum 14 jam lembur per minggu yang diizinkan.","['e. memberlakukan keselamatan dan kesehatan kerja;\nf. adanya hubungan kerja yang jelas;\ng. memberikan upah sesuai dengan ketentuan yang berlaku ( Pasal\n68,69 ).\n Dalam hal seorang anak bekerja pada tempat yang sama dengan orang\ndewasa, maka tempat kerja untuk anak harus dipisah ( Pasal 72 ).\n Siapapun dilarang mempekerjakan anak pada pekerjaan-pekerjaan yang\nterburuk, seperti:\na. segala pekerjaan dalam bentuk perbudakan atau sejenisnya;b. segala pekerjaan yang melibatkan pornografi;c. semua pekerjaan yang berkaitan dengan narkoba, dan lain-lain yang\nsejenisnya;\nd. semua pekerjaan yang membahayakan kesehatan, keselamatan, dan/\natau moral anak ( Pasal 74 ).\n B. Pekerja Perempuan\nPasal 76 mengatur bahwa perempuan berusia dibawah 18 tahun tidak\ndiijinkan untuk bekerja antara jam 23.00 – 07.00.   Larangan juga berlakubagi perempuan hamil karena potensi risiko kesehatan.  Perusahaan yangmempekerjakan pekerja perempuan pada jam antara 23.00 – 07.00 harus:\nlmemberikan makanan dan minuman bergizi;\nlmenjaga kesusilaan dan keamanan di tempat kerja;\nlmenyediakan angkutan antar jemput.\n C. Jam Kerja\nJam kerja dapat diatur sebagai berikut:\nl7 (tujuh) jam satu hari dan  40 (empat puluh) jam  per mingguuntuk 6 (enam) hari kerja dalam satu minggu, atau\nl8 (delapan) jam per hari dan 40 (empat puluh) jam per mingguuntuk 5 lima) hari dalam satu minggu.\n Pekerjaan lembur hanya dapat dilaksanakan dengan syarat bahwa\npekerja/buruh bersangkutan telah menyetujuinya, dan pekerjaan lemburadalah maksimum 3 (tiga) jam dalam satu hari dan 14 (empat belas) jamdalam satu minggu.\n 20', 'e. memberlakukan keselamatan dan kesehatan kerja;\nf. adanya hubungan kerja yang jelas;\ng. memberikan upah sesuai dengan ketentuan yang berlaku ( Pasal\n68,69 ).\n Dalam hal seorang anak bekerja pada tempat yang sama dengan orang\ndewasa, maka tempat kerja untuk anak harus dipisah ( Pasal 72 ).\n Siapapun dilarang mempekerjakan anak pada pekerjaan-pekerjaan yang\nterburuk, seperti:\na. segala pekerjaan dalam bentuk perbudakan atau sejenisnya;b. segala pekerjaan yang melibatkan pornografi;c. semua pekerjaan yang berkaitan dengan narkoba, dan lain-lain yang\nsejenisnya;\nd. semua pekerjaan yang membahayakan kesehatan, keselamatan, dan/\natau moral anak ( Pasal 74 ).\n B. Pekerja Perempuan\nPasal 76 mengatur bahwa perempuan berusia dibawah 18 tahun tidak\ndiijinkan untuk bekerja antara jam 23.00 – 07.00.   Larangan juga berlakubagi perempuan hamil karena potensi risiko kesehatan.  Perusahaan yangmempekerjakan pekerja perempuan pada jam antara 23.00 – 07.00 harus:\nlmemberikan makanan dan minuman bergizi;\nlmenjaga kesusilaan dan keamanan di tempat kerja;\nlmenyediakan angkutan antar jemput.\n C. Jam Kerja\nJam kerja dapat diatur sebagai berikut:\nl7 (tujuh) jam satu hari dan  40 (empat puluh) jam  per mingguuntuk 6 (enam) hari kerja dalam satu minggu, atau\nl8 (delapan) jam per hari dan 40 (empat puluh) jam per mingguuntuk 5 lima) hari dalam satu minggu.\n Pekerjaan lembur hanya dapat dilaksanakan dengan syarat bahwa\npekerja/buruh bersangkutan telah menyetujuinya, dan pekerjaan lemburadalah maksimum 3 (tiga) jam dalam satu hari dan 14 (empat belas) jamdalam satu minggu.\n 20', '(4) Ketentuan mengenai waktu kerja pada sektor usaha atau pekerjaan tertentu sebagaimana\ndimaksud dalam ayat (3) diatur dengan Keputusan Menteri.\n Pasal 78\n(1) Pengusaha yang mempekerjakan pekerja/buruh melebihi waktu kerja sebagaimana dimaksud\ndalam Pasal 77 ayat (2) harus memenuhi syarat :\na. ada persetujuan pekerja/buruh yang bersangkutan; dan\nb. waktu kerja lembur hanya dapat dilakukan paling banyak 3 (tiga) jam dalam 1 (satu) hari\ndan 14 (empat belas) jam dalam 1 (satu) minggu.\n (2) Pengusaha yang mempekerjakan pekerja/buruh melebihi waktu kerja sebagaimana dimaksud\ndalam ayat (1) wajib membayar upah kerja lembur.\n (3) Ketentuan waktu kerja lembur sebagaimana dimaksud dalam ayat (1) huruf b tidak berlaku bagi\nsektor usaha atau pekerjaan tertentu.\n (4) Ketentuan mengenai waktu kerja lembur dan upah kerja lembur sebagaimana dimaksud dalam\nayat (2) dan ayat (3) diatur dengan Keputusan Menteri.\n Pasal 79\n(1) Pengusaha wajib memberi waktu istirahat dan cuti kepada pekerja/buruh.\n (2) Waktu istirahat dan cuti sebagaimana dimaksud dalam ayat (1), meliputi :\na. istirahat antara jam kerja, sekurang kurangnya setengah jam setelah bekerja selama 4\n(empat) jam terus menerus dan waktu istirahat tersebut tidak termasuk jam kerja;\nb. istirahat mingguan 1 (satu) hari untuk 6 (enam) hari kerja dalam 1 (satu) minggu atau 2\n(dua) hari untuk 5 (lima) hari kerja dalam 1 (satu) minggu;\nc. cuti tahunan, sekurang kurangnya 12 (dua belas) hari kerja setelah pekerja/buruh yang\nbersangkutan bekerja selama 12 (dua belas) bulan secara terus menerus; dan\nd. istirahat panjang sekurang-kurangnya 2 (dua) bulan dan dilaksanakan pada tahun\nketujuh dan kedelapan masing-masing 1 (satu) bulan bagi pekerja/buruh yang telah bekerja\nselama 6 (enam) tahun secara terus-menerus pada perusahaan yang sama dengan ketentuan\npekerja/buruh tersebut tidak berhak lagi atas istirahat tahunannya dalam 2 (dua) tahun berjalan\ndan selanjutnya berlaku untuk setiap kelipatan masa kerja 6 (enam) tahun.\n (3) Pelaksanaan waktu istirahat tahunan sebagaimana dimaksud dalam ayat (2) huruf c diatur dalam\nperjanjian kerja, peraturan perusahaan, atau perjanjian kerja bersama.\n (4) Hak istirahat panjang sebagaimana dimaksud dalam ayat (2) huruf d hanya berlaku bagi\npekerja/buruh yang bekerja pada perusahaan tertentu.\n (5) Perusahaan tertentu sebagaimana dimaksud dalam ayat (4) diatur dengan Keputusan Menteri.\n']","Apabila hanya diberi pizza, tanpa upah lembur, maka itu telah melanggar peraturan. sesuai dengan Pasal 187 ayat 1 pada Undang-undang Nomor 13 Tahun 2003 pengusaha dapat dikenakan sanksi pidana kurungan paling singkat 1 (satu) bulan dan paling lama 12 (dua belas) bulan dan/atau denda paling sedikit Rp 10.000.000,00 (sepuluh juta rupiah) dan paling banyak Rp 100.000.000,00 (seratus juta rupiah)."
5,Sanksi apa yang dapat dikenakan pada pengusaha yang mempekerjakan pekerjaanya pada hari libur resmi tanpa membayar upah kerja lembur?,"Berdasarkan Pasal 85 ayat (3) Undang-Undang Ketenagakerjaan, pengusaha yang mempekerjakan pekerja pada hari libur resmi wajib membayar upah kerja lembur. Jika pengusaha tidak membayar upah kerja lembur tersebut, maka pengusaha dapat dikenakan sanksi pidana kurungan paling singkat 1 (satu) bulan dan paling lama 12 (dua belas) bulan dan/atau denda paling sedikit Rp.10.000.000 (sepuluh juta rupiah) dan paling banyak Rp.100.000.000 (seratus juta rupiah) sesuai dengan Pasal 187 Undang-Undang Ketenagakerjaan.","['(2) Pelaksanaan ketentuan sebagaimana dimaksud dalam ayat (1) diatur dalam perjanjian kerja,\nperaturan perusahaan, atau perjanjian kerja bersama.\n Pasal 82\n(1) Pekerja/buruh perempuan berhak memperoleh istirahat selama 1,5 (satu setengah) bulan sebelum\nsaatnya melahirkan anak dan 1,5 (satu setengah) bulan sesudah melahirkan menurut\nperhitungan dokter kandungan atau bidan.\n (2) Pekerja/buruh perempuan yang mengalami keguguran kandungan berhak memperoleh istirahat\n1,5 (satu setengah) bulan atau sesuai dengan surat keterangan dokter kandungan atau bidan.\n Pasal 83\nPekerja/buruh perempuan yang anaknya masih menyusu harus diberi kesempatan sepatutnya\nuntuk menyusui anaknya  jika hal itu harus dilakukan selama waktu kerja.\n Pasal 84\nSetiap pekerja/buruh yang menggunakan hak waktu istirahat sebagaimana dimaksud dalam\nPasal 79  ayat (2) huruf   b, c, dan d,  Pasal  80, dan Pasal 82  berhak mendapat upah penuh.\n Pasal 85\n(1) Pekerja/buruh tidak wajib bekerja pada hari-hari libur resmi.\n (2) Pengusaha dapat mempekerjakan pekerja/buruh untuk bekerja pada hari-hari libur resmi apabila\njenis dan sifat pekerjaan tersebut harus dilaksanakan atau dijalankan secara terus- menerus atau\npada keadaan lain berdasarkan kesepakatan antara pekerja/buruh dengan pengusaha.\n (3) Pengusaha yang mempekerjakan pekerja/buruh yang melakukan pekerjaan pada hari libur resmi\nsebagaimana dimaksud dalam ayat (2) wajib membayar  upah kerja lembur.\n (4) Ketentuan mengenai jenis dan sifat pekerjaan sebagaimana dimaksud dalam ayat (2) diatur\ndengan Keputusan Menteri.\n Paragraf 5\nKeselamatan dan Kesehatan Kerja\n Pasal 86\n(1)  Setiap pekerja/buruh mempunyai hak untuk memperoleh perlindungan atas :\na.   keselamatan dan kesehatan kerja;\nb.   moral dan kesusilaan; dan\nc.   perlakuan yang sesuai dengan harkat dan martabat manusia serta nilai-nilai agama.\n (2) Untuk melindungi keselamatan pekerja/buruh guna mewujudkan produktivitas kerja yang optimal\ndiselenggarakan upaya keselamatan dan kesehatan kerja.\n (3) Perlindungan sebagaimana dimaksud dalam ayat (1) dan ayat (2) dilaksanakan sesuai dengan\nperaturan perundang- undangan yang berlaku.', '(2) Pelaksanaan ketentuan sebagaimana dimaksud dalam ayat (1) diatur dalam perjanjian kerja,\nperaturan perusahaan, atau perjanjian kerja bersama.\n Pasal 82\n(1) Pekerja/buruh perempuan berhak memperoleh istirahat selama 1,5 (satu setengah) bulan sebelum\nsaatnya melahirkan anak dan 1,5 (satu setengah) bulan sesudah melahirkan menurut\nperhitungan dokter kandungan atau bidan.\n (2) Pekerja/buruh perempuan yang mengalami keguguran kandungan berhak memperoleh istirahat\n1,5 (satu setengah) bulan atau sesuai dengan surat keterangan dokter kandungan atau bidan.\n Pasal 83\nPekerja/buruh perempuan yang anaknya masih menyusu harus diberi kesempatan sepatutnya\nuntuk menyusui anaknya  jika hal itu harus dilakukan selama waktu kerja.\n Pasal 84\nSetiap pekerja/buruh yang menggunakan hak waktu istirahat sebagaimana dimaksud dalam\nPasal 79  ayat (2) huruf   b, c, dan d,  Pasal  80, dan Pasal 82  berhak mendapat upah penuh.\n Pasal 85\n(1) Pekerja/buruh tidak wajib bekerja pada hari-hari libur resmi.\n (2) Pengusaha dapat mempekerjakan pekerja/buruh untuk bekerja pada hari-hari libur resmi apabila\njenis dan sifat pekerjaan tersebut harus dilaksanakan atau dijalankan secara terus- menerus atau\npada keadaan lain berdasarkan kesepakatan antara pekerja/buruh dengan pengusaha.\n (3) Pengusaha yang mempekerjakan pekerja/buruh yang melakukan pekerjaan pada hari libur resmi\nsebagaimana dimaksud dalam ayat (2) wajib membayar  upah kerja lembur.\n (4) Ketentuan mengenai jenis dan sifat pekerjaan sebagaimana dimaksud dalam ayat (2) diatur\ndengan Keputusan Menteri.\n Paragraf 5\nKeselamatan dan Kesehatan Kerja\n Pasal 86\n(1)  Setiap pekerja/buruh mempunyai hak untuk memperoleh perlindungan atas :\na.   keselamatan dan kesehatan kerja;\nb.   moral dan kesusilaan; dan\nc.   perlakuan yang sesuai dengan harkat dan martabat manusia serta nilai-nilai agama.\n (2) Untuk melindungi keselamatan pekerja/buruh guna mewujudkan produktivitas kerja yang optimal\ndiselenggarakan upaya keselamatan dan kesehatan kerja.\n (3) Perlindungan sebagaimana dimaksud dalam ayat (1) dan ayat (2) dilaksanakan sesuai dengan\nperaturan perundang- undangan yang berlaku.', 'memberikan kesempatan kepada para pekerja untuk menunaikan ibadah yang\ndiwajibkan agamanya,  Pasal 82 tentang hak istirahat melahirkan, Pasal 90(1)\ntentang upah minimum,  Pasal 143 tentang pencegahan hak mogok kerja,\ndan Pasal 160(4) dan (7) tentang mempekerjakan pekerja kembali yang\ndinyatakan tidak bersalah oleh pengadilan , dan tidak membayar uang\npenghargaan masa kerja, dan imbalan atas hak-hak kepada pekerja yangmengalami pemutusah hubungan kerja  dapat dikenakan pidana penjara paling\nsingkat 1 (satu) tahun dan paling lama 5 (lima) tahun dan/atau denda palingsedikit Rp.  100,000,000 (seratus juta rupiah) dan paling banyakRp.400,000,000  (empat ratus juta rupiah) ( Pasal 185 ).\n Barang siapa melanggar ketentuan sebagaimana dimaksud dalam Pasal\n93(2) tentang pengecualian upah bagi para pekerja yang tidak dapat\nmelakukan pekerjaan,  Pasal 137 dan Pasal 138(1) tentang   mogok kerja\ndapat dikenakan saksi pidana penjara paling singkat 1 (satu) bulan danpaling lama 4 (empat) bulan dan/atau denda paling sedikit Rp.  10,000,000(sepuluh juta rupiah) dan paling banyak Rp.400,000,000 (empat ratus jutarupiah) ( Pasal 186 ).\n Barang siapa melanggar ketentuan sebagaimana dimaksud dalam Pasal\n67(1) tentang perlindungan kepada tenaga kerja penyandang cacat,  Pasal 71(2)\ntentang persyaratan untuk mempekerjakan anak, Pasal 76 tentang pekerja\nperempuan,  Pasal 78(2) tentang pembayaran upah kerja lembur, Pasal 79(1)\n(2) tentang waktu istirahat dan istirahat,  Pasal 85(3) tentang pembayaran\nupah kerja lembur pada waktu hari libur resmi,  dan Pasal 144 tentang\nlarangan bagi perusahaan untuk mengganti pekerja dan memberikan sanksikepada para pekerja yang ikut melakukan  mogok kerja  dapat dikenakan\nsanksi pidana kurungan paling singkat 1 (satu) bulan dan paling lama 12(dua belas) bulan dan/atau denda paling sedikit Rp.10,000,000 (sepuluhjuta rupiah) dan paling banyak  Rp.100,000,000 (seratus juta rupiah) ( Pasal\n187).\n Barang siapa melanggar ketentuan sebagaimana dimaksud dalam Pasal\n63(1) tentang  kewajiban untuk membuat surat pengangkatan dalam\nperjanjian kerja waktu tidak tertentu yang dibuat secara lisan,  Pasal 78(1)\ntentang persyaratan waktu kerja lembur, Pasal 108(1) tentang kewajiban\nmembuat peraturan perusahaan, Pasal 111(3) tentang pembaharuan peraturan\nperusahaan,  dan Pasal 148 tentang pemberitahuan tertulis mengenai\npenutupan perusahaan, dikenakan sanksi pidana denda paling sedikit\nRp.5,000,000 – (lima juta rupiah) dan paling banyak Rp.50,000,000 –(lima puluh juta rupiah) ( Pasal 188 ).\n 45']","Sesuai dengan Pasal 187 ayat 1 pada Undang-undang Nomor 13 Tahun 2003, pengusaha dapat dikenakan sanksi pidana kurungan paling singkat 1 (satu) bulan dan paling lama 12 (dua belas) bulan dan/atau denda paling sedikit Rp 10.000.000,00 (sepuluh juta rupiah) dan paling banyak Rp 100.000.000,00 (seratus juta rupiah)."
6,"Apabila pekerja tidak bekerja karena menikahkan anaknya, apakah tetap berhak mendapatkan upah?","Ya, pekerja yang tidak masuk bekerja karena menikahkan anaknya tetap berhak mendapatkan upah sesuai dengan ketentuan pada poin c dalam konteks yang diberikan.","['(3) Upah yang dibayarkan kepada pekerja/buruh yang sakit sebagaimana dimaksud dalam ayat (2)\nhuruf  a sebagai berikut :\na.   untuk 4 (empat) bulan pertama, dibayar 100% (seratus perseratus) dari upah;\nb.   untuk 4 (empat) bulan kedua, dibayar 75% (tujuh puluh lima perseratus) dari upah;\nc.   untuk 4 (empat) bulan ketiga, dibayar 50% (lima puluh perseratus) dari upah; dan\nd.   untuk bulan selanjutnya dibayar 25% (dua puluh lima perseratus) dari upah sebelum pemutusan\nhubungan kerja dilakukan oleh pengusaha.\n (4) Upah yang dibayarkan kepada pekerja/buruh yang tidak masuk bekerja sebagaimana dimaksud\ndalam ayat (2) huruf c sebagai berikut :\na.   pekerja/buruh menikah, dibayar untuk selama 3 (tiga) hari;\nb.   menikahkan anaknya, dibayar untuk selama 2 (dua) hari;\nc.   mengkhitankan anaknya, dibayar untuk selama 2 (dua) hari\nd.   membaptiskan anaknya, dibayar untuk selama 2 (dua) hari;\ne.   isteri melahirkan atau keguguran kandungan, dibayar untuk selama 2 (dua) hari;\nf.   suami/isteri, orang tua/mertua atau anak atau menantu meninggal dunia, dibayar untuk selama 2\n(dua) hari; dan\ng.  anggota keluarga dalam satu rumah meninggal dunia, dibayar untuk selama 1 (satu) hari.\n (5) Pengaturan pelaksanaan ketentuan  sebagaimana dimaksud  dalam ayat (2) ditetapkan dalam\nperjanjian kerja, peraturan perusahaan,  atau perjanjian kerja bersama.\n Pasal 94\nDalam  hal komponen upah terdiri dari upah pokok dan tunjangan  tetap maka besarnya  upah\npokok sedikit-dikitnya 75 % (tujuh puluh lima perseratus) dari jumlah upah pokok dan tunjangan\ntetap.\n Pasal 95\n(1) Pelanggaran yang dilakukan oleh pekerja/buruh karena kesengajaan atau kelalaiannya dapat\ndikenakan denda.\n (2) Pengusaha yang karena kesengajaan atau kelalaiannya mengakibatkan keterlambatan\npembayaran upah, dikenakan denda sesuai dengan persentase tertentu dari upah pekerja/buruh.\n (3) Pemerintah mengatur pengenaan denda kepada pengusaha dan/atau pekerja/buruh, dalam\npembayaran upah.\n (4) Dalam hal perusahaan dinyatakan pailit atau dilikuidasi berdasarkan peraturan perundang-\nundangan yang berlaku, maka upah dan hak-hak lainnya dari pekerja/buruh merupakan utang\nyang didahulukan pem-bayarannya.\n Pasal 96\nTuntutan pembayaran upah pekerja/buruh dan segala pembayaran yang timbul dari hubungan\nkerja menjadi kadaluwarsa setelah melampaui jangka waktu    2 (dua)  tahun sejak  timbulnya\nhak.\n Pasal 97\nKetentuan  mengenai penghasilan yang layak, kebijakan pengupahan, kebutuhan hidup layak,\ndan perlindungan pengupahan sebagaimana dimaksud dalam Pasal 88, penetapan upah\nminimum sebagaimana dimaksud dalam Pasal 89,  dan pengenaan denda  sebagaimana', '(2) Bagi pengusaha yang tidak mampu membayar upah minimum sebagaimana dimaksud dalam\nPasal 89 dapat dilakukan  penangguhan.\n (3) Tata cara penangguhan sebagaimana dimaksud dalam ayat (2) diatur dengan Keputusan Menteri.\n Pasal 91\n(1) Pengaturan pengupahan yang ditetapkan atas kesepakatan antara pengusaha dan pekerja/buruh\natau serikat pekerja/serikat buruh tidak boleh lebih rendah dari ketentuan pengupahan yang\nditetapkan  peraturan perundang-undangan yang berlaku.\n (2) Dalam hal kesepakatan sebagaimana dimaksud dalam ayat (1) lebih rendah atau bertentangan\ndengan peraturan perundang-undangan, kesepakatan tersebut batal demi hukum, dan\npengusaha wajib membayar upah pekerja/buruh menurut peraturan perundang-undangan yang\nberlaku.\n Pasal 92\n(1) Pengusaha menyusun struktur dan skala upah dengan memperhatikan  golongan,  jabatan, masa\nkerja, pendidikan, dan kompetensi.\n (2) Pengusaha melakukan peninjauan upah secara berkala dengan mem-perhatikan  kemampuan\nperusahaan dan produktivitas.\n (3) Ketentuan mengenai struktur dan skala upah sebagaimana dimaksud dalam ayat (1) diatur\ndengan Keputusan Menteri.\n Pasal 93\n(1) Upah  tidak  dibayar  apabila pekerja/buruh tidak melakukan pekerjaan.\n (2) Ketentuan sebagaimana dimaksud dalam ayat (1) tidak berlaku, dan pengusaha wajib membayar\nupah apabila :\na.  pekerja/buruh sakit sehingga tidak dapat melakukan pekerjaan;\nb.  pekerja/buruh perempuan yang sakit pada hari pertama dan kedua masa haidnya sehingga tidak\ndapat melakukan pekerjaan;\nc.  pekerja/buruh tidak masuk bekerja karena pekerja/buruh menikah, menikahkan, mengkhitankan,\nmembaptiskan anaknya, isteri melahirkan atau keguguran kandungan, suami atau isteri atau\nanak atau menantu atau orang tua atau mertua atau anggota keluarga dalam satu rumah\nmeninggal dunia;\nd.  pekerja/buruh tidak dapat melakukan pekerjaannya karena sedang menjalankan kewajiban\nterhadap negara;\ne.  pekerja/buruh  tidak dapat melakukan pekerjaannya karena menjalan-kan ibadah yang\ndiperintahkan agamanya;\nf.   pekerja/buruh bersedia melakukan pekerjaan yang telah dijanjikan tetapi pengusaha tidak\nmempekerjakannya, baik karena kesalahan sendiri maupun halangan yang seharusnya dapat\ndihindari  pengusaha;\ng.  pekerja/buruh melaksanakan hak istirahat;\nh.  pekerja/buruh melaksanakan tugas serikat pekerja/serikat buruh atas persetujuan pengusaha;\ndan\ni.   pekerja/buruh melaksanakan tugas pendidikan dari perusahaan.', 'berkala dengan memperhatikan kemampuan dan produktivitas perusahaan.\n Upah tidak akan dibayar jika pekerja/buruh tidak melakukan\npekerjaannya.  Pengecualian, antara lain, adalah:\na. pekerja/buruh dalam keadaan sakit;\nb. Keluhan yang dialami pekerja perempuan pada hari pertama dan\nkedua waktu menstruasi;\nc. pekerja/buruh yang menikah (3 hari), anaknya  laki-laki/perempuan\nmenikah, sunatan bagi anak laki-lakinya, pembabtisan bagi anaklaki-laki/perempuan , isteri melahirkan atau mengalami keguguran,\nkematian suami/isteri anak/orangtua/mertua dari pekerja (2 hariuntuk setiap kejadian), kematian anggota keluarga yang tinggal didalam rumah yang sama (1 hari);\nd. pekerja/buruh sedang melakukan kewajiban (tugas) negara;\ne. pekerja/buruh melakukan kewajiban agama.\n Permintaan pembayaran upah para pekerja dan pembayaran lainnya\nkadaluarsa setelah dua tahun.\n 22']","Pekerja yang tidak bekerja disebabkan sedang menikahkan anaknya berhak diupah sesuai pasal 93 ayat 2. Besarannya 2 hari upah, sesuai yang diatur pada pasal 93 ayat 4."
7,"Apabila perusahaan pailit, apakah saya tetap berhak mendapatkan upah dan hak-hak jaminan sosial lainnya?","Ya, jika perusahaan dinyatakan pailit atau dilikuidasi berdasarkan peraturan perundang-undangan yang berlaku, maka upah dan hak-hak lainnya dari pekerja/buruh merupakan utang yang harus didahulukan pembayarannya.","['(3) Upah yang dibayarkan kepada pekerja/buruh yang sakit sebagaimana dimaksud dalam ayat (2)\nhuruf  a sebagai berikut :\na.   untuk 4 (empat) bulan pertama, dibayar 100% (seratus perseratus) dari upah;\nb.   untuk 4 (empat) bulan kedua, dibayar 75% (tujuh puluh lima perseratus) dari upah;\nc.   untuk 4 (empat) bulan ketiga, dibayar 50% (lima puluh perseratus) dari upah; dan\nd.   untuk bulan selanjutnya dibayar 25% (dua puluh lima perseratus) dari upah sebelum pemutusan\nhubungan kerja dilakukan oleh pengusaha.\n (4) Upah yang dibayarkan kepada pekerja/buruh yang tidak masuk bekerja sebagaimana dimaksud\ndalam ayat (2) huruf c sebagai berikut :\na.   pekerja/buruh menikah, dibayar untuk selama 3 (tiga) hari;\nb.   menikahkan anaknya, dibayar untuk selama 2 (dua) hari;\nc.   mengkhitankan anaknya, dibayar untuk selama 2 (dua) hari\nd.   membaptiskan anaknya, dibayar untuk selama 2 (dua) hari;\ne.   isteri melahirkan atau keguguran kandungan, dibayar untuk selama 2 (dua) hari;\nf.   suami/isteri, orang tua/mertua atau anak atau menantu meninggal dunia, dibayar untuk selama 2\n(dua) hari; dan\ng.  anggota keluarga dalam satu rumah meninggal dunia, dibayar untuk selama 1 (satu) hari.\n (5) Pengaturan pelaksanaan ketentuan  sebagaimana dimaksud  dalam ayat (2) ditetapkan dalam\nperjanjian kerja, peraturan perusahaan,  atau perjanjian kerja bersama.\n Pasal 94\nDalam  hal komponen upah terdiri dari upah pokok dan tunjangan  tetap maka besarnya  upah\npokok sedikit-dikitnya 75 % (tujuh puluh lima perseratus) dari jumlah upah pokok dan tunjangan\ntetap.\n Pasal 95\n(1) Pelanggaran yang dilakukan oleh pekerja/buruh karena kesengajaan atau kelalaiannya dapat\ndikenakan denda.\n (2) Pengusaha yang karena kesengajaan atau kelalaiannya mengakibatkan keterlambatan\npembayaran upah, dikenakan denda sesuai dengan persentase tertentu dari upah pekerja/buruh.\n (3) Pemerintah mengatur pengenaan denda kepada pengusaha dan/atau pekerja/buruh, dalam\npembayaran upah.\n (4) Dalam hal perusahaan dinyatakan pailit atau dilikuidasi berdasarkan peraturan perundang-\nundangan yang berlaku, maka upah dan hak-hak lainnya dari pekerja/buruh merupakan utang\nyang didahulukan pem-bayarannya.\n Pasal 96\nTuntutan pembayaran upah pekerja/buruh dan segala pembayaran yang timbul dari hubungan\nkerja menjadi kadaluwarsa setelah melampaui jangka waktu    2 (dua)  tahun sejak  timbulnya\nhak.\n Pasal 97\nKetentuan  mengenai penghasilan yang layak, kebijakan pengupahan, kebutuhan hidup layak,\ndan perlindungan pengupahan sebagaimana dimaksud dalam Pasal 88, penetapan upah\nminimum sebagaimana dimaksud dalam Pasal 89,  dan pengenaan denda  sebagaimana', 'v. Alasan Lain Yang Sah untuk Pemutusan Hubungan Kerja\nlPekerja itu tidak ingin meneruskan hubungan kerjanya karena\nadanya suatu perubahan dalam status perusahaan, bergabung,peleburan, atau pergantian kepemilikan perusahaan ( Pasal\n163(1) );\nlPerusahaan harus ditutup akibat dari kerugian yang diderita oleh\nperusahaan selama dua tahun berturut-turut atau keadaan daruratatau force majeure  (Pasal 164(1) );\nlPerusahaan mengalami bangkrut ( Pasal 165 );\nlPekerja meninggal dunia ( Pasal 166 );\nlPekerja mencapai usia pensiun.  Dalam hal perusahaan mengikuti\nprogram pensiun dan semua uang iuran dibayar oleh perusahaan,pekerja tidak mempunyai hak atas pembayaran pesangon danpembayaran uang jasa, akan tetapi dia berhak memperolehpembayaran uang penggantian hak ( Pasal 167(1) ).   Apabila\nperusahaan tidak mengikuti salah satu program pensiun pekerjayang pensiun tersebut berhak mendapat dua kali pembayaranpesangon, pembayaran uang jasa, dan uang penggantian hak-hak yang belum diambil ( Pasal 167(5) );\nlJika seorang pekerja telah mangkir dari pekerjaan selama lima\nhari kerja atau lebih secara berturut-turut tanpa memberikanpemberitahuan dan bukti yang sah kepada perusahaan, danperusahaan telah memanggil pekerja dua kali secara tertulis,perusahaan dapat memutuskan hubungan kerja dengan pekerjatersebut.  Dalam hal ini pekerja memperoleh pembayaran uangpenggantian hak dan uang pisah yang besarnya diatur dalamperjanjian kerja, peraturan perusahaan, atau perjanjian kerjabersama  ( Pasal 168 ).\n vi.  Oleh Pekerja\nBerdasarkan Pasal 169, pekerja dapat mengajukan pemutusan\nhubungan kerja yang ditujukan kepada Lembaga PPHI apabilaperusahaan telah melakukan salah satu dari tindakan ini:\na. Menganiaya, menghina secara kasar, atau melakukan ancaman\nterhadap pekerja;\nb. mengajak atau memerintahkan pekerja untuk melakukan\n39', 'v. Alasan Lain Yang Sah untuk Pemutusan Hubungan Kerja\nlPekerja itu tidak ingin meneruskan hubungan kerjanya karena\nadanya suatu perubahan dalam status perusahaan, bergabung,peleburan, atau pergantian kepemilikan perusahaan ( Pasal\n163(1) );\nlPerusahaan harus ditutup akibat dari kerugian yang diderita oleh\nperusahaan selama dua tahun berturut-turut atau keadaan daruratatau force majeure  (Pasal 164(1) );\nlPerusahaan mengalami bangkrut ( Pasal 165 );\nlPekerja meninggal dunia ( Pasal 166 );\nlPekerja mencapai usia pensiun.  Dalam hal perusahaan mengikuti\nprogram pensiun dan semua uang iuran dibayar oleh perusahaan,pekerja tidak mempunyai hak atas pembayaran pesangon danpembayaran uang jasa, akan tetapi dia berhak memperolehpembayaran uang penggantian hak ( Pasal 167(1) ).   Apabila\nperusahaan tidak mengikuti salah satu program pensiun pekerjayang pensiun tersebut berhak mendapat dua kali pembayaranpesangon, pembayaran uang jasa, dan uang penggantian hak-hak yang belum diambil ( Pasal 167(5) );\nlJika seorang pekerja telah mangkir dari pekerjaan selama lima\nhari kerja atau lebih secara berturut-turut tanpa memberikanpemberitahuan dan bukti yang sah kepada perusahaan, danperusahaan telah memanggil pekerja dua kali secara tertulis,perusahaan dapat memutuskan hubungan kerja dengan pekerjatersebut.  Dalam hal ini pekerja memperoleh pembayaran uangpenggantian hak dan uang pisah yang besarnya diatur dalamperjanjian kerja, peraturan perusahaan, atau perjanjian kerjabersama  ( Pasal 168 ).\n vi.  Oleh Pekerja\nBerdasarkan Pasal 169, pekerja dapat mengajukan pemutusan\nhubungan kerja yang ditujukan kepada Lembaga PPHI apabilaperusahaan telah melakukan salah satu dari tindakan ini:\na. Menganiaya, menghina secara kasar, atau melakukan ancaman\nterhadap pekerja;\nb. mengajak atau memerintahkan pekerja untuk melakukan\n39']",Bagi perusahaan yang pailit upah dan hak-hak lainnya yang dimiliki pekerja/buruh akan menjadi utang yang didahulukan pembayarannya oleh pengusaha.
8,"Dalam hubungan industrial, apa fungsi dari pengusaha?","Dalam hubungan industrial, fungsi dari pengusaha adalah menciptakan kemitraan, mengembangkan usaha, memperluas lapangan kerja, dan memberikan kesejahteraan pekerja/buruh secara terbuka, demokratis, dan berkeadilan.","['pekerja/serikat buruh mempunyai fungsi menjalankan pekerjaan sesuai\ndengan kewajibannya, menjaga ketertiban demi kelangsungan produksi,menyalurkan aspirasi  secara demokratis, mengembangkan keterampilan,dan keahliannya serta ikut memajukan perusahaan dan memperjuangkankesejahteraan anggota beserta keluarganya.\n Pengusaha dan organisasi pengusahanya mempunyai fungsi\nmenciptakan kemitraan, mengembangkan usaha, memperluas lapangankerja, dan memberikan kesejahteraan pekerja/buruh secara terbuka,demokratis, dan berkeadilan.\n Dalam hubungan ini, pemerintah dan perwakilan/lembaganya\nmenetapkan kebijakan dan pengawasan Undang-undang Ketenagakerjaan.Dalam hal terjadi pelanggaran  terhadap peratuan perundang-undanganketenagakerjaan pemerintah akan mengambil tindakan yang tepat untukmenjamin ketaatan atas pelaksanaan peraturan perundang-undangan ini.\n B. Serikat Pekerja/Serikat Buruh\nHak untuk membentuk dan menjadi anggota serikat pekerja/serikat\nburuh sebagai seorang pekerja/buruh diatur dalam Pasal 104.   Ketentuanitu juga mengatur bahwa serikat pekerja/serikat buruh berhak menghimpundan mengelola keuangan serta mempertanggung jawabkan keuanganorganisasi termasuk dana mogok.   Besarnya dan tata cara pemungutan danamogok diatur dalam anggaran dasar/anggaran rumah tangga serikat pekerja/serikat buruh yang bersangkutan.\n C. Organisasi Pengusaha\nSetiap pengusaha juga berhak membentuk dan menjadi anggota\norganisasi pengusaha sebagiamana diatur dalam  Pasal 105.\n D. Lembaga Kerja Sama\na. Lembaga Kerja Sama Bipartit\nAgar dapat menciptakan lingkungan yang harmonis dalam hubungan\nindustrial dan untuk memastikan saling pengertian antara pekerja/buruhdan pengusaha pada tingkat perusahaan, suatu proses komunikasi dankonsultasi yang teratur dan bermanfaat diantara mereka mengenai halketenagakerjaan akan dilakukan dalam Lembaga Kerja sama Bipartit\n24', 'Umum\nPasal 102\n(1) Dalam melaksanakan hubungan industrial, pemerintah mempunyai fungsi menetapkan kebijakan,\nmemberikan pelayanan, melaksanakan pengawasan, dan melakukan penindakan terhadap\npelanggaran peraturan perundang-undangan ketenagakerjaan.\n (2) Dalam melaksanakan hubungan industrial, pekerja/buruh dan serikat pekerja/serikat buruhnya\nmempunyai fungsi menjalankan pekerjaan sesuai dengan kewajibannya, menjaga ketertiban\ndemi kelangsungan produksi, menyalurkan aspirasi secara demokratis, mengembangkan\nketerampilan, dan keahliannya serta ikut memajukan perusahaan dan memperjuangkan\nkesejahteraan anggota beserta keluarganya.\n (3) Dalam melaksanakan hubungan industrial, pengusaha dan organisasi pengusahanya mempunyai\nfungsi menciptakan kemitraan, mengembang-kan usaha, memperluas lapangan kerja, dan\nmemberikan kesejahteraan pekerja/buruh secara terbuka, demokratis, dan berkeadilan.\n Pasal 103\nHubungan Industrial dilaksanakan melalui sarana :\na. serikat pekerja/serikat buruh;\nb. organisasi pengusaha;\nc. lembaga kerja sama bipartit;\nd. embaga kerja sama tripartit;\ne. peraturan perusahaan;\nf. perjanjian kerja bersama;\ng. peraturan perundang-undangan ketenagakerjaan; dan\nh. lembaga penyelesaian perselisihan hubungan industrial.\n Bagian Kedua\nSerikat Pekerja/Serikat Buruh\nPasal 104\n(1) Setiap pekerja/buruh berhak membentuk dan menjadi anggota serikat pekerja/serikat buruh.\n (2) Dalam melaksanakan fungsi sebagaimana dimaksud dalam Pasal 102, serikat pekerja/serikat\nburuh ber-hak menghimpun dan mengelola keuangan serta mempertanggungjawabkan\nkeuangan organisasi termasuk dana mogok.\n (3) Besarnya dan tata cara pemungutan dana mogok sebagaimana dimaksud dalam ayat (2) diatur\ndalam ang-garan dasar dan/atau anggaran rumah tangga serikat pekerja/serikat buruh yang\nbersangkutan.\n Bagian Ketiga\nOrganisasi Pengusaha\nPasal 105\n(1) Setiap pengusaha berhak membentuk dan menjadi anggota organisasi pengusaha.', 'Umum\nPasal 102\n(1) Dalam melaksanakan hubungan industrial, pemerintah mempunyai fungsi menetapkan kebijakan,\nmemberikan pelayanan, melaksanakan pengawasan, dan melakukan penindakan terhadap\npelanggaran peraturan perundang-undangan ketenagakerjaan.\n (2) Dalam melaksanakan hubungan industrial, pekerja/buruh dan serikat pekerja/serikat buruhnya\nmempunyai fungsi menjalankan pekerjaan sesuai dengan kewajibannya, menjaga ketertiban\ndemi kelangsungan produksi, menyalurkan aspirasi secara demokratis, mengembangkan\nketerampilan, dan keahliannya serta ikut memajukan perusahaan dan memperjuangkan\nkesejahteraan anggota beserta keluarganya.\n (3) Dalam melaksanakan hubungan industrial, pengusaha dan organisasi pengusahanya mempunyai\nfungsi menciptakan kemitraan, mengembang-kan usaha, memperluas lapangan kerja, dan\nmemberikan kesejahteraan pekerja/buruh secara terbuka, demokratis, dan berkeadilan.\n Pasal 103\nHubungan Industrial dilaksanakan melalui sarana :\na. serikat pekerja/serikat buruh;\nb. organisasi pengusaha;\nc. lembaga kerja sama bipartit;\nd. embaga kerja sama tripartit;\ne. peraturan perusahaan;\nf. perjanjian kerja bersama;\ng. peraturan perundang-undangan ketenagakerjaan; dan\nh. lembaga penyelesaian perselisihan hubungan industrial.\n Bagian Kedua\nSerikat Pekerja/Serikat Buruh\nPasal 104\n(1) Setiap pekerja/buruh berhak membentuk dan menjadi anggota serikat pekerja/serikat buruh.\n (2) Dalam melaksanakan fungsi sebagaimana dimaksud dalam Pasal 102, serikat pekerja/serikat\nburuh ber-hak menghimpun dan mengelola keuangan serta mempertanggungjawabkan\nkeuangan organisasi termasuk dana mogok.\n (3) Besarnya dan tata cara pemungutan dana mogok sebagaimana dimaksud dalam ayat (2) diatur\ndalam ang-garan dasar dan/atau anggaran rumah tangga serikat pekerja/serikat buruh yang\nbersangkutan.\n Bagian Ketiga\nOrganisasi Pengusaha\nPasal 105\n(1) Setiap pengusaha berhak membentuk dan menjadi anggota organisasi pengusaha.']","Pengusaha mempunyai fungsi menciptakan kemitraan, mengembangkan usaha, memperluas lapangan kerja, dan memberikan kesejahteraan pekerja secara terbuka, demokratis, dan berkeadilan."
9,Apakah serikat pekerja merupakan unsur yang termasuk dalam lembaga kerja sama bipartit?,"Ya, serikat pekerja/serikat buruh merupakan salah satu unsur yang termasuk dalam lembaga kerja sama bipartit. Berdasarkan konteks yang diberikan, disebutkan bahwa susunan keanggotaan lembaga kerja sama bipartit terdiri dari unsur pengusaha dan unsur pekerja/buruh, di mana serikat pekerja/serikat buruh mewakili unsur pekerja/buruh.","['Pembentukan lembaga ini diwajibkan dalam setiap perusahaan yang\nmempekerjakan 50 (lima puluh) pekerja atau lebih.   Susunan keanggotanLembaga Kerja Sama Bipartit terdiri dari unsur pengusaha dan unsurpekerja/buruh.  Pekerja/buruh perusahaan secara demokratis menunjukperwakilan mereka untuk mewakili kepentingan pekerja/buruh ( Pasal\n106).\n b. Lembaga Kerja sama Tripartit\nTidak seperti Lembaga Kerja sama Bipartit, Lembaga Kerja sama Tripartit\nditetapkan pada tingkat kabupaten/kota, propinsi, serta tingkat nasional.Susunan keanggotaan lembaga ini terdiri dari 3 (tiga) unsur yaitu unsurpemerintah, pengusaha, dan serikat pekerja.   Berdasarkan Pasal 107,lembaga kerja sama tripartit berfungsi menyediakan forum proseskomunikasi yang berkesinambungan diantara ketiga pihak untukmemberikan pertimbangan, saran, dan pendapat kepada pemerintahuntuk menyusun peraturan perundang-undangan yang baru  danmenetapkan kebijakan untuk menyelesaikan masalah-masalahketenagakerjaan ( Pasal 107 ).\n E. Peraturan Perusahaan\nStandar dan persyaratan untuk peraturan perusahaan secara khusus\ndimuat dalam Pasal-Pasal 108-115.  Pasal-pasal tersebut adalah mengatursyarat kerja (hak dan kewajiban pekerja/buruh dan pengusaha).  Peraturanperusahaan adalah dokumen yang disusun oleh dan menjadi tanggung jawabdari pengusaha yang mempekerjakan 10 (sepuluh) pekerja atau lebih untukmemiliki peraturan perusahaan ( Pasal 108 ).\n Dalam proses penyusunan peraturan perusahaan manajemen atau\npengusaha harus mengadakan konsultasi dengan perwakilan pekerja/buruhatau serikat kerja/serikat buruh.  Berdasarkan Pasal 111(1), peraturanperusahaan sekurang-kurangnya memuat hal-hal berikut:\na.  Hak dan kewajiban pengusaha;b.  Hak dan kewajiban pekerja/buruh;c.  Syarat kerja;\nd. Tata tertib perusahaan;\ne. Jangka waktu berlakunya peraturan perusahaan.\n', 'Pembentukan lembaga ini diwajibkan dalam setiap perusahaan yang\nmempekerjakan 50 (lima puluh) pekerja atau lebih.   Susunan keanggotanLembaga Kerja Sama Bipartit terdiri dari unsur pengusaha dan unsurpekerja/buruh.  Pekerja/buruh perusahaan secara demokratis menunjukperwakilan mereka untuk mewakili kepentingan pekerja/buruh ( Pasal\n106).\n b. Lembaga Kerja sama Tripartit\nTidak seperti Lembaga Kerja sama Bipartit, Lembaga Kerja sama Tripartit\nditetapkan pada tingkat kabupaten/kota, propinsi, serta tingkat nasional.Susunan keanggotaan lembaga ini terdiri dari 3 (tiga) unsur yaitu unsurpemerintah, pengusaha, dan serikat pekerja.   Berdasarkan Pasal 107,lembaga kerja sama tripartit berfungsi menyediakan forum proseskomunikasi yang berkesinambungan diantara ketiga pihak untukmemberikan pertimbangan, saran, dan pendapat kepada pemerintahuntuk menyusun peraturan perundang-undangan yang baru  danmenetapkan kebijakan untuk menyelesaikan masalah-masalahketenagakerjaan ( Pasal 107 ).\n E. Peraturan Perusahaan\nStandar dan persyaratan untuk peraturan perusahaan secara khusus\ndimuat dalam Pasal-Pasal 108-115.  Pasal-pasal tersebut adalah mengatursyarat kerja (hak dan kewajiban pekerja/buruh dan pengusaha).  Peraturanperusahaan adalah dokumen yang disusun oleh dan menjadi tanggung jawabdari pengusaha yang mempekerjakan 10 (sepuluh) pekerja atau lebih untukmemiliki peraturan perusahaan ( Pasal 108 ).\n Dalam proses penyusunan peraturan perusahaan manajemen atau\npengusaha harus mengadakan konsultasi dengan perwakilan pekerja/buruhatau serikat kerja/serikat buruh.  Berdasarkan Pasal 111(1), peraturanperusahaan sekurang-kurangnya memuat hal-hal berikut:\na.  Hak dan kewajiban pengusaha;b.  Hak dan kewajiban pekerja/buruh;c.  Syarat kerja;\nd. Tata tertib perusahaan;\ne. Jangka waktu berlakunya peraturan perusahaan.\n 25', 'Hubungan kerja adalah hubungan antara pengusaha dengan pekerja/buruh berdasarkan\nperjanjian kerja, yang mempunyai unsur pekerjaan, upah, dan perintah.\n 16.  Hubungan industrial adalah suatu sistem hubungan yang terbentuk antara para pelaku\ndalam proses produksi barang dan/atau jasa yang terdiri dari unsur pengusaha, pekerja/buruh,\ndan pemerintah yang didasarkan pada nilai nilai Pancasila dan Undang Undang Dasar Negara\nRepublik Indonesia Tahun 1945.\n 17.  Serikat pekerja/serikat buruh adalah organisasi yang dibentuk dari, oleh, dan untuk\npekerja/buruh baik di perusahaan maupun di luar perusahaan, yang bersifat bebas, terbuka,\nmandiri, demokratis, dan bertanggung jawab guna memperjuangkan, membela serta melindungi\nhak dan kepentingan pekerja/buruh serta meningkatkan kesejahteraan pekerja/buruh dan\nkeluarganya.\n 18.  Lembaga kerja sama bipartit adalah forum komunikasi dan konsultasi mengenai hal-hal\nyang berkaitan dengan hubungan industrial di satu perusahaan yang anggotanya terdiri dari\npengusaha dan serikat pekerja/ serikat buruh yang sudah tercatat instansi yang bertanggung\njawab di bidang ketenagakerjaan atau unsur pekerja/buruh.\n 19.  Lembaga kerja sama tripartit adalah forum komunikasi, konsultasi dan musyawarah\ntentang masalah ketenagakerjaan yang anggotanya terdiri dari unsur organisasi pengusaha,\nserikat pekerja/serikat buruh, dan pemerintah.\n 20.  Peraturan perusahaan adalah peraturan yang dibuat secara tertulis oleh pengusaha yang\nmemuat syarat syarat kerja dan tata tertib perusahaan.\n 21.  Perjanjian kerja bersama adalah perjanjian yang merupakan hasil perundingan antara\nserikat pekerja/serikat buruh atau beberapa serikat pekerja/serikat buruh yang tercatat pada\ninstansi yang bertanggung jawab di bidang ketenagakerjaan dengan pengusaha, atau beberapa\npengusaha atau perkumpulan pengusaha yang memuat syarat syarat kerja, hak dan kewajiban\nkedua belah pihak.\n 22.  Perselisihan hubungan industrial adalah perbedaan pendapat yang mengakibatkan\npertentangan antara pengusaha atau gabungan pengusaha dengan pekerja/buruh atau serikat\npekerja/serikat buruh karena adanya perselisihan mengenai hak, perselisihan kepentingan, dan\nperselisihan pemutusan hubungan kerja serta perselisihan antar serikat pekerja/serikat buruh\nhanya dalam satu perusahaan.']","Tidak. Unsur serikat pekerja ada di dalam lembaga kerja sama tripartit, bersama dengan unsur pemerintah dan organisasi pengusaha, sesuai dengan pasal 107 ayat 3. Pada lembaga kerja sama bipartit terdiri dari unsur pengusaha dan unsur pekerja/buruh yang ditunjuk oleh pekerja/buruh secara demokratis untuk mewakili kepentingan pekerja/buruh di perusahaan yang bersangkutan, sesuai dengan pasal 106 ayat 3."
10,Sanksi apa yang akan dikenakan pada pengusaha yang mengganti pekerja mogok dengan pekerja dari luar?,"Berdasarkan Pasal 144, pengusaha dilarang mengganti pekerja/buruh yang mogok kerja dengan pekerja/buruh lain dari luar perusahaan. Jika pengusaha melakukan hal tersebut, maka pengusaha dapat dikenakan sanksi sesuai dengan peraturan perundang-undangan yang berlaku.","['a. mengganti pekerja/buruh yang mogok kerja dengan pekerja/buruh lain dari luar\nperusahaan; atau\nb. memberikan sanksi atau tindakan balasan dalam bentuk apapun kepada pekerja/buruh\ndan pengurus serikat pekerja/serikat buruh selama dan sesudah melakukan mogok kerja.\n Pasal 145\nDalam hal pekerja/buruh yang melakukan mogok kerja secara sah dalam melakukan tuntutan\nhak normatif yang sungguh-sungguh dilanggar oleh pengusaha, pekerja/buruh berhak\nmendapatkan upah.\n Paragraf 3\nPenutupan Perusahaan (lock-out)\nPasal 146\n(1) Penutupan perusahaan (lock out) merupakan hak dasar pengusaha untuk menolak pekerja/buruh\nsebagian atau seluruhnya untuk menjalankan pekerjaan sebagai akibat gagalnya perundingan.\n (2) Pengusaha tidak dibenarkan melakukan penutupan perusahaan (lock out) sebagai tindakan\nbalasan sehubungan adanya tuntutan normatif dari pekerja/buruh dan/atau serikat pekerja/serikat\nburuh.\n (3) Tindakan penutupan perusahaan (lock out) harus dilakukan sesuai dengan ketentuan hukum yang\nberlaku.\n Pasal 147\nPenutupan perusahaan (lock out) dilarang dilakukan pada perusahaan-perusahaan yang\nmelayani kepentingan umum dan/atau jenis kegiatan yang membahayakan keselamatan jiwa\nmanusia, meliputi rumah sakit, pelayanan jaringan air bersih, pusat pengendali telekomunikasi,\npusat penyedia tenaga listrik, pengolahan minyak dan gas bumi, serta kereta api.\n Pasal 148\n(1) Pengusaha wajib memberitahukan secara tertulis kepada pekerja/buruh dan/atau serikat\npekerja/serikat buruh, serta instansi yang bertanggung jawab di bidang ketenagakerjaan\nsetempat sekurang-kurangnya 7 (tujuh) hari kerja sebelum penutupan perusahaan (lock out)\ndilaksanakan.\n (2) Pemberitahuan sebagaimana dimaksud dalam ayat (1) sekurang-kurangnya memuat :\na. waktu (hari, tanggal, dan jam) dimulai dan diakhiri penutupan perusahaan (lock out); dan\nb. alasan dan sebab-sebab melakukan penutupan perusahaan (lock out).\n (3) Pemberitahuan sebagaimana dimaksud dalam ayat (1) ditandatangani oleh pengusaha dan/atau\npimpinan perusahaan yang bersangkutan.\n', 'sakit, pemadam kebakaran, pengatur lalu lintas udara, penjaga pintu\nair, penjaga perlintasan rel kereta api, dan pengawas penyeberangan laut.\n c. Hal-hal yang Dilarang Ketika Melakukan Aksi Mogok\ni. Bagi pengusaha:\nPengusaha dilarang mengganti pekerja/buruh yang mogok kerja\ndengan pekerja/buruh lain dari luar perusahaan atau memberikansanksi atau tindakan balasan dalam bentuk apapun kepada pekerja/buruh dan/atau serikat pekerja/serikat buruh selama dan sesudahmelakukan mogok kerja.   ( Pasal 144 ).\n ii.  Bagi Pihak Lain\nSiapapun tidak diijinkan untuk menghalang-halangi pekerja/buruh\nuntuk menggunakan hak mogok kerja yang dilakukan secara sah,tertib dan damai.  Juga tidak diijinkan melakukan  penangkapandan/atau penahanan terhadap pekerja/buruh dan pengurus serikatpekerja/serikat buruh yang melakukan mogok kerja secara sah, tertib,dan damai sesuai dengan perundang-undangan yang berlaku.  ( Pasal\n143).\n d. Upah Ketika Melakukan Mogok Kerja\nPengusaha harus membayar upah pekerja/buruh ketika mereka\nmelakukan mogok kerja dengan ketentuan bahwa mogok kerjadilakukan untuk tuntutan hak normatif, seperti pengusaha melanggarundang-undang dan peraturan perundang-undangan ketenagakerjaan,perjanjian kerja, peraturan perusahaan, atau perjanjian kerja bersama(Pasal 145 ).\n 32', 'sakit, pemadam kebakaran, pengatur lalu lintas udara, penjaga pintu\nair, penjaga perlintasan rel kereta api, dan pengawas penyeberangan laut.\n c. Hal-hal yang Dilarang Ketika Melakukan Aksi Mogok\ni. Bagi pengusaha:\nPengusaha dilarang mengganti pekerja/buruh yang mogok kerja\ndengan pekerja/buruh lain dari luar perusahaan atau memberikansanksi atau tindakan balasan dalam bentuk apapun kepada pekerja/buruh dan/atau serikat pekerja/serikat buruh selama dan sesudahmelakukan mogok kerja.   ( Pasal 144 ).\n ii.  Bagi Pihak Lain\nSiapapun tidak diijinkan untuk menghalang-halangi pekerja/buruh\nuntuk menggunakan hak mogok kerja yang dilakukan secara sah,tertib dan damai.  Juga tidak diijinkan melakukan  penangkapandan/atau penahanan terhadap pekerja/buruh dan pengurus serikatpekerja/serikat buruh yang melakukan mogok kerja secara sah, tertib,dan damai sesuai dengan perundang-undangan yang berlaku.  ( Pasal\n143).\n d. Upah Ketika Melakukan Mogok Kerja\nPengusaha harus membayar upah pekerja/buruh ketika mereka\nmelakukan mogok kerja dengan ketentuan bahwa mogok kerjadilakukan untuk tuntutan hak normatif, seperti pengusaha melanggarundang-undang dan peraturan perundang-undangan ketenagakerjaan,perjanjian kerja, peraturan perusahaan, atau perjanjian kerja bersama(Pasal 145 ).\n 32']","Berdasarkan pasal 144 ayat 1, pengusaha dilarang mengganti pekerja mogok denga pekerja dari luar perusahaan. Sesuai dengan Pasal 187 ayat 1 pada Undang-undang Nomor 13 Tahun 2003, pengusaha dapat dikenakan sanksi pidana kurungan paling singkat 1 (satu) bulan dan paling lama 12 (dua belas) bulan dan/atau denda paling sedikit Rp 10.000.000,00 (sepuluh juta rupiah) dan paling banyak Rp 100.000.000,00 (seratus juta rupiah)."
11,"Apabila saya diberhentikan setelah bekerja selama 3 tahun 9 bulan, berapa uang pesangon yang berhak saya dapatkan?","Berdasarkan tabel yang diberikan, jika Anda bekerja selama 3 tahun 9 bulan, maka uang pesangon yang berhak Anda dapatkan adalah 4 bulan upah terakhir.","['(4) Ketentuan sebagaimana dimaksud dalam ayat (1), ayat (2), dan ayat (3) dapat diatur lain dalam\nperjanjian kerja, peraturan perusahaan, atau perjanjian kerja bersama.\n (5) Dalam hal pengusaha tidak mengikutsertakan pekerja/buruh yang mengalami pemutusan\nhubungan kerja karena usia pensiun pada program pensiun maka pengusaha wajib memberikan\nkepada pekerja/buruh uang pesangon sebesar 2 (dua) kali ketentuan Pasal 156 ayat (2), uang\npenghargaan masa kerja 1 (satu) kali ketentuan Pasal 156 ayat (3) dan uang penggantian hak\nsesuai ketentuan Pasal 156 ayat (4).\n (6) Hak atas manfaat pensiun sebagaimana yang dimaksud dalam ayat (1), ayat (2), ayat (3), dan\nayat (4) ti-dak menghilangkan hak pekerja/buruh atas jaminan hari tua yang bersifat wajib sesuai\ndengan peraturan perundang-undangan yang berlaku.\n Pasal 168\n(1) Pekerja/buruh yang mangkir selama 5 (lima) hari kerja atau lebih berturut-turut tanpa keterangan\nsecara ter tulis yang dilengkapi dengan bukti yang sah dan telah dipanggil oleh pengusaha 2\n(dua) kali secara patut dan tertulis dapat diputus hubungan kerjanya karena dikualifikasikan\nmengundurkan diri.\n (2) Keterangan tertulis dengan bukti yang sah sebagaimana dimaksud dalam ayat (1) harus\ndiserahkan paling lambat pada hari pertama pekerja/buruh masuk bekerja.\n (3) Pemutusan hubungan kerja sebagaimana dimaksud dalam ayat (1) pekerja/buruh yang\nbersangkutan berhak menerima uang penggantian hak sesuai ketentuan Pasal 156 ayat (4) dan\ndiberikan uang pisah yang besarnya dan pelaksanaannya diatur dalam perjanjian kerja,\nperaturan perusahaan, atau perjanjian kerja bersama.\n Pasal 169\n(1) Pekerja/buruh dapat mengajukan permohonan pemutusan hubungan kerja kepada lembaga\npenyelesaian perselisihan hubungan industrial dalam hal pengusaha melakukan perbuatan\nsebagai berikut :\na. menganiaya, menghina secara kasar atau mengancam pekerja/buruh;\nb. membujuk dan/atau menyuruh pekerja/buruh untuk melakukan perbuatan yang\nbertentangan dengan peraturan perundang-undangan;\nc. tidak membayar upah tepat pada waktu yang telah ditentukan selama 3 (tiga) bulan\nberturut-turut atau lebih;\nd. tidak melakukan kewajiban yang telah dijanjikan kepada pekerja/ buruh;\ne. memerintahkan pekerja/buruh untuk melaksanakan pekerjaan di luar yang diperjanjikan;\natau\nf. memberikan pekerjaan yang membahayakan jiwa, keselamatan, kesehatan, dan\nkesusilaan pekerja/buruh sedangkan pekerjaan tersebut tidak dicantumkan pada perjanjian kerja.\n (2) Pemutusan hubungan kerja dengan alasan sebagaimana dimaksud dalam ayat (1) pekerja/buruh\nberhak mendapat uang pesangon 2 (dua) kali ketentuan Pasal 156 ayat (2), uang penghargaan\nmasa kerja 1 (satu) kali ketentuan Pasal 156 ayat (3), dan uang penggantian hak sesuai\nketentuan Pasal 156 ayat (4).\n (3) Dalam hal pengusaha dinyatakan tidak melakukan perbuatan sebagaimana dimaksud dalam ayat\n(1) oleh lembaga penyelesaian perselisihan hubungan industrial maka pengusaha dapat\nmelakukan pemutusan hubungan kerja tanpa penetapan lembaga penyelesaian perselisihan\nhubungan industrial dan pekerja/buruh yang bersangkutan tidak berhak atas uang pesangon\nsesuai ketentuan Pasal 156 ayat (2), dan uang penghargaan masa kerja sesuai ketentuan Pasal\n156 ayat (3).', '(6) Pemutusan hubungan kerja sebagaimana dimaksud dalam ayat (3) dan ayat (5) dilakukan tanpa\npenetapan lembaga penyelesaian perselisihan hubungan industrial.\n (7) Pengusaha wajib membayar kepada pekerja/buruh yang mengalami pemutusan hubungan kerja\nsebagai-mana dimaksud dalam ayat (3) dan ayat (5), uang penghargaan masa kerja 1 (satu) kali\nketentuan Pasal 156 ayat (3) dan uang penggantian hak sesuai ketentuan dalam Pasal 156 ayat\n(4).\n Pasal 161\n(1) Dalam hal pekerja/buruh melakukan pelanggaran ketentuan yang diatur dalam perjanjian kerja,\nperaturan perusahaan atau perjanjian kerja bersama, pengusaha dapat melakukan pemutusan\nhubungan kerja, setelah kepada pekerja/buruh yang bersangkutan diberikan surat peringatan\npertama, kedua, dan ketiga secara berturut-turut.\n (2) Surat peringatan sebagaimana dimaksud dalam ayat (1) masing-masing berlaku untuk paling lama\n6 (enam) bulan, kecuali ditetapkan lain dalam perjanjian kerja, peraturan perusahaan atau\nperjanjian kerja bersama.\n (3) Pekerja/buruh yang mengalami pemutusan hubungan kerja dengan alasan sebagaimana\ndimaksud dalam ayat (1) memperoleh uang pesangon sebesar 1 (satu) kali ketentuan Pasal 156\nayat (2), uang penghargaan masa kerja sebesar 1 (satu) kali ketentuan Pasal 156 ayat (3) dan\nuang penggantian hak sesuai ketentuan Pasal 156 ayat (4).\n Pasal 162\n(1) Pekerja/buruh yang mengundurkan diri atas kemauan sendiri, memperoleh uang penggantian hak\nsesuai ketentuan Pasal 156 ayat (4).\n (2) Bagi pekerja/buruh yang mengundurkan diri atas kemauan sendiri, yang tugas dan fungsinya tidak\nme-wakili kepentingan pengusaha secara langsung, selain menerima uang penggantian hak\nsesuai ketentuan Pasal 156 ayat (4) diberikan uang pisah yang besarnya dan pelaksanaannya\ndiatur dalam perjanjian kerja, peraturan perusahaan atau perjanjian kerja bersama.\n (3) Pekerja/buruh yang mengundurkan diri sebagaimana dimaksud dalam ayat (1) harus memenuhi\nsyarat :\na. mengajukan permohonan pengunduran diri secara tertulis selambat-lambatnya 30 (tiga\npuluh) hari sebelum tanggal mulai pengunduran diri;\nb. tidak terikat dalam ikatan dinas; dan\nc. tetap melaksanakan kewajibannya sampai tanggal mulai pengunduran diri.\n (4) Pemutusan hubungan kerja dengan alasan pengunduran diri atas kemauan sendiri dilakukan\ntanpa pene-tapan lembaga penyelesaian perselisihan hubungan industrial.\n Pasal 163\n(1) Pengusaha dapat melakukan pemutusan hubungan kerja terhadap pekerja/buruh dalam hal terjadi\nperu-bahan status, penggabungan, peleburan, atau perubahan kepemilikan perusahaan dan\npekerja/buruh tidak bersedia melanjutkan hubungan kerja, maka pekerja/buruh berhak atas uang\npesangon sebesar 1 (satu) kali sesuai ketentuan Pasal 156 ayat (2), uang perhargaan masa\nkerja 1 (satu) kali ketentuan Pasal 156 ayat (3) dan uang penggantian hak sesuai ketentuan\ndalam Pasal 156 ayat (4).\n (2) Pengusaha dapat melakukan pemutusan hubungan kerja terhadap pekerja/buruh karena\nperubahan status, penggabungan, atau peleburan perusahaan, dan pengusaha tidak bersedia\nmenerima pekerja/buruh di perusahaannya, maka pekerja/buruh berhak atas uang pesangon\nsebesar 2 (dua) kali ketentuan Pasal 156 ayat (2), uang penghargaan masa kerja 1 (satu) kali', 'Pembayaran Uang JasaLebih dari 8 tahun Sembilan bulan upahKurang dari 1  tahun Satu bulan upah\nLebih dari 1 th dan kurang dari 2 th Dua bulan upah\nLebih dari 2 th dan kurang dari 3 thn Tiga bulan upah\nLebih dari 3 th dan kurang dari 4 th Empat bulan upah\nLebih dari 4 th dan kurang dari 5 th Lima bulan upah\nLebih dari 5 th dan kurang dari 6 th Enam bulan upah\nLebih dari 6 th dan kurang dari 7 th T ujuh bulan upah\nLebih dari 7 th dan kurang dari 8 th Delapan bulan upahPembayaran Uang Pesangon\n(minimum)Masa Kerja\nMasa Kerja\nTiga th sampai enam th Dua bulan upah\nEnam th sampai sembilan th Tiga bulan upah\nSembilan th sampai dua belas th Empat bulan upah\nDua belas th sampai lima belas th Lima bulan upah\nLima belas th sampai delapan belas th Enam bulan upah\nDelapan belas th s.d dua puluh satu th T ujuh bulan upah\nDua puluh satu s.d dua puluh empat th Delapan bulan upah\nDua puluh empat th atau lebih Sepuluh bulan upahBesarnya jumlah tunjangan (manfaat) keuangan adalah sebagai berikut:\nPembayaran Uang Pesangon\nPembayaran Uang Jasa\n(minimum)\n41']","Berdasarkan pasal 156 ayat 2, pekerja yang telah diberhentikan setelah bekerja selama 3 tahun atau lebih tetapi kurang dari 4 tahun, berhak mendapatkan uang pesangon sebesar 4 bulan upah."
